{
  "schema_version": 1,
  "mod_id": "AdminUI",
  "name": "AdminUI",
  "authors": [
    {
      "name": "Buuz135",
      "url": "https://buuz135.com/"
    }
  ],
  "links": {
    "source": "https://github.com/Buuz135/AdminUI",
    "curseforge": "https://www.curseforge.com/hytale/mods/adminui"
  }
}
