{
  "schema_version": 1,
  "mod_id": "MacawsHyPaintings",
  "name": "Macaw's Hy Paintings",
  "summary": "Adds over 90 hand drawn paintings which can be cycled!",
  "authors": [
    {
      "name": "Sketch Macaw",
      "url": "https://www.curseforge.com/members/sketch_macaw"
    }
  ],
  "links": {
    "curseforge": "https://www.curseforge.com/hytale/mods/macaws-hy-paintings"
  }
}
