{
  "schema_version": 1,
  "mod_id": "MacawsHyPaths",
  "name": "Macaw's Hy Paths",
  "authors": [
    {
      "name": "Sketch Macaw",
      "url": "https://www.curseforge.com/members/sketch_macaw"
    }
  ],
  "links": {
    "curseforge": "https://www.curseforge.com/hytale/mods/macaws-hy-paths"
  }
}
