{
  "schema_version": 1,
  "mod_id": "NotEnoughPoops",
  "name": "Not Enough Poops",
  "authors": [
    {
      "name": "Sketch Macaw",
      "url": "https://www.curseforge.com/members/sketch_macaw"
    }
  ],
  "links": {
    "curseforge": "https://www.curseforge.com/hytale/mods/not-enough-poops"
  }
}
