{
  "schema_version": 1,
  "mod_id": "MacawsHyLightsAndLamps",
  "name": "Macaw's Hy Lights and Lamps",
  "authors": [
    {
      "name": "Sketch Macaw",
      "url": "https://www.curseforge.com/members/sketch_macaw"
    }
  ],
  "links": {
    "curseforge": "https://www.curseforge.com/hytale/mods/macaws-hy-lights-and-lamps"
  }
}

