{
  "schema_version": 1,
  "mod_id": "MacawsHyDoors",
  "name": "Macaw's Hy Doors",
  "authors": [
    {
      "name": "Sketch Macaw",
      "url": "https://www.curseforge.com/members/sketch_macaw"
    }
  ],
  "links": {
    "curseforge": "https://www.curseforge.com/hytale/mods/macaws-hy-doors"
  }
}