{
  "schema_version": 1,
  "mod_id": "YmmersiveFoliage",
  "name": "Ymmersive Foliage",
  "authors": [
    {
      "name": "Conczin",
      "url": "https://conczin.net/"
    }
  ],
  "links": {
    "source": "https://github.com/Luke100000/YmmersiveFoliage",
    "curseforge": "https://www.curseforge.com/hytale/mods/ymmersive-foliage"
  }
}
