{
  "schema_version": 1,
  "mod_id": "YmmersiveStatues",
  "name": "Ymmersive Statues",
  "authors": [
    {
      "name": "Conczin",
      "url": "https://conczin.net/"
    }
  ],
  "links": {
    "source": "https://github.com/Luke100000/YmmersiveStatues",
    "curseforge": "https://www.curseforge.com/hytale/mods/ymmersive-statues"
  }
}
