{
  "schema_version": 1,
  "mod_id": "YmmersiveMelodies",
  "name": "Ymmersive Melodies",
  "authors": [
    {
      "name": "Conczin",
      "url": "https://conczin.net/"
    }
  ],
  "links": {
    "source": "https://github.com/Luke100000/YmmersiveMelodies",
    "curseforge": "https://www.curseforge.com/hytale/mods/ymmersive-melodies"
  }
}
