{
  "schema_version": 1,
  "mod_id": "YmmersiveCarpentry",
  "name": "Ymmersive Carpentry",
  "authors": [
    {
      "name": "Conczin",
      "url": "https://conczin.net/"
    }
  ],
  "links": {
    "source": "https://github.com/Luke100000/YmmersiveCarpentry",
    "curseforge": "https://www.curseforge.com/hytale/mods/ymmersive-carpentry"
  }
}
