{
  "schema_version": 1,
  "mod_id": "BetterModlist",
  "name": "Advanced Item Info",
  "authors": [
    {
      "name": "Buuz135",
      "url": "https://buuz135.com/"
    }
  ],
  "links": {
    "source": "https://github.com/Buuz135/Better-Modlist",
    "curseforge": "https://www.curseforge.com/hytale/mods/better-modlist"
  }
}
